{
  "general": {
    "age": {
      "from": 16,
      "to": 20
    },
    "gender": "man",
    "race_id": 2,
    "firstname": "Dominik",
    "lastname": "Klapuch"
  },
  "hair": {
    "style": "normal",
    "color_id": 8,
    "length": {
      "value": 20,
      "unit": "mm"
    },
    "highlights": false,
    "roots": true,
    "nature": false
  },
  "face": {
    "teeth": {
      "care": 5,
      "braces": false
    },
    "freckles": false,
    "beard": {
      "color_id": 8,
      "length": {
        "value": 2,
        "unit": "mm"
      },
      "style": "none"
    },
    "shape": "oval",
    "care": 10,
    "eyebrow": {
      "color_id": 8,
      "care": 2
    },
    "eye": {
      "left": {
        "color_id": 8,
        "lenses": false
      },
      "right": {
        "color_id": 8,
        "lenses": false
      }
    }
  },
  "body": {
    "build_id": 1,
    "skin_color_id": 8,
    "weight": 60,
    "height": 181
  },
  "location": {
    "coordinates": {
      "latitude": 50.1,
      "longitude": 50.2
    },
    "met_at": {
      "moment": "2017-01-01T13:58:10+00:00",
      "timeline_side": "sooner",
      "approximation": "PT3H"
    }
  },
  "hands": {
    "nails": {
      "color_id": null,
      "length": {
        "value": null,
        "unit": "mm"
      },
      "care": null
    },
    "care": 10,
    "vein_visibility": 5,
    "joint_visibility": 1,
    "hair": {
      "color_id": 8,
      "amount": 5
    }
  }
}